{"artifact_id":"sha256:44d77dd1d806c7ff7be5d60b0b8437629ca1feeb20ff64859eeaa945f449ffc5","attempt_interval":{"clock":{"digest":"sha256:122a9d8aaab2d04c58fe1b436a5c774262bf84f3fd1b27eacbcf474552edc80b","id":"clock.utc.nq","version":"1"},"clock_uncertainty_ms":1,"ended_at":"2026-07-27T20:00:04Z","started_at":"2026-07-27T20:00:03Z"},"canonicalization":{"digest":"sha256:e49d92d4e86052e66ed2a481b9386d3b214ce3d2df5fd109a6491ccb9ffb24f3","id":"rfc8785-jcs","version":"1"},"claims":[{"claim_id":"claim:load-pressure","condition_effect":"explicitly_absent","dependency_input_ids":["input:001"],"limitations":["one snapshot does not identify a cause"],"nonclaims":["no remediation is authorized"],"proposition":"host load pressure is absent","required_distinctions":["workflow_attempt"],"state_binding_ids":["state:boot-a"],"status":"established"}],"completed_at":"2026-07-27T20:00:04Z","evaluator":{"digest":"sha256:da5288d3196013574817382bb44c2d018c460f33c7eccf149bab3d21329cf72b","id":"evaluator:nq","version":"1"},"execution_clock":{"digest":"sha256:122a9d8aaab2d04c58fe1b436a5c774262bf84f3fd1b27eacbcf474552edc80b","id":"clock.utc.nq","version":"1"},"inputs":{"admitted":[{"admission_rule":{"digest":"sha256:c725c2b88fec6d2de9737915485b2bc97e3f7cfeb157993f539ab5f02c190e3e","id":"admission:host-v1","version":"1"},"input_id":"input:001","normalization_rule":{"digest":"sha256:f6e5cae03cc2f8c8cb3ca73c0a40540812952acd727da5fc8dd839dd75c94de8","id":"normalization:host-v1","version":"1"},"normalized_artifact_id":"sha256:b32b577d63a2a22e3a6b63b830d8b421e5f628091bfd3d9b9391b27c802fe23a","projected_artifact_id":"sha256:3a4b077ae91cf041590272fd6af50448cbc21dce0d9efc265644b47a4f034270","projection_rule":{"digest":"sha256:085657b2cf52a508a580fde0bcffbfe1d7b63f4df0fcd929ae4d87f4d4c6cad6","id":"projection-rule:host-load-v1","version":"1"}}],"excluded":[],"expected":[{"expectation_id":"expected:host-snapshot","required":true,"role":"host_snapshot"}],"failed":[],"received":[{"acquisition":{"clock":{"digest":"sha256:7be5d611b587fe0c518da1d2b7deb6d7710ccb8e47ba230acd62dcd14988fa34","id":"clock.utc.provider","version":"1"},"clock_uncertainty_ms":5,"ended_at":"2026-07-27T20:00:02Z","started_at":"2026-07-27T20:00:01Z"},"availability_at_derivation":"online","capture_mode":"exact_source","capture_policy":{"digest":"sha256:d7489f88ed9ba1c950e54e482cfaf2f5d54e196a1fd5ad4bc976a9ae55d398e3","id":"capture:exact-source-v1","version":"1"},"expectation_id":"expected:host-snapshot","input_id":"input:001","raw_artifact_id":"sha256:335e7bf95904a4a61e760d5791b9bee9bbff9155538e694758ce9c9ff1935655","received_at":"2026-07-27T20:00:03Z"}],"refused":[],"selected":[{"input_id":"input:001","projected_artifact_id":"sha256:3a4b077ae91cf041590272fd6af50448cbc21dce0d9efc265644b47a4f034270","role":"host_snapshot"}],"selection_rule":{"digest":"sha256:dab34757603c4ff00376ba6691cffba2b744ccaba136af3ae14240d5b365d2ff","id":"selection:newest-current","version":"1"}},"limitations":[],"nonclaims":["this artifact grants no reliance or authorization","this artifact reports one bounded diagnostic execution"],"outcome":{"coherence":"jointly_established","condition":"explicitly_absent","coverage":"complete","derivation":"completed","summary":"complete current testimony places load below threshold"},"primary_claim_id":"claim:load-pressure","producer":{"build":{"digest":"sha256:5f2c421dd8c15ea8fe7ed75ff223f449f622b76b413d63a34ff51e29bb4a2d10","id":"nq-build","version":"1"},"cohort":{"digest":"sha256:463db0ebf5839bbd5dd685dc21f7c00faa2da801cec4559431fa641a4cd33360","id":"nq-cohort","version":"1"},"node_id":"nq-node:fixture"},"profile":{"digest":"sha256:849583b5c74fdb0c1b2223a79fbd965038aa3981e30092d710ef52dca1f62677","id":"profile:host","version":"1"},"projection":{"identity":{"digest":"sha256:224b19ff377023d4d2b97cac8e3b06b14fc1f9efb8e0ba6220d527a8589ed16e","id":"projection:load-full","version":"1"},"omitted_distinctions":[{"code":"workflow_attempt","detail":"the child projection erased workflow-attempt identity"}]},"question":{"digest":"sha256:b2d6b993e3c0d4d02aa0ace0053ae55fd4b77a375f318dcb3c4fd43c67c57f0c","id":"diagnostic:host-load","version":"1"},"request_id":"request:001","run_id":"run:001","schema":"nq.diagnostic_execution.v1","started_at":"2026-07-27T20:00:03Z","state_bindings":[{"binding_id":"state:boot-a","kind":"boot_epoch","supporting_input_ids":["input:001"],"value":"boot-a"}],"state_model":{"digest":"sha256:d4193d57ec67ad200a93f75d3014f66d533cdb91a7482150710256a3e0db8346","id":"state-model:boot","version":"1"},"subject":{"id":"host:fixture","scope":{"digest":"sha256:cfea2d9e350d18243cdd78a64f25a62376116ba7e4a717e8b13742c6ec277619","id":"scope:host","version":"1"}},"threshold_policy":{"digest":"sha256:1e582b43263de81f4bbdb0ea1ea4ef67f5c2779157b8c855142d56c1d88f1e12","id":"threshold:load","version":"1"},"vantage":{"digest":"sha256:7639f3c9683695aeb233f3561f06b32dba59e666819fcc47d5367692b071dd87","id":"vantage:host-local","version":"1"}}