{"artifact_id":"sha256:2317140a92006ccff37cac92cb129e92c7d1205f0676457c364cc43055d80dab","attempt_interval":{"clock":{"digest":"sha256:122a9d8aaab2d04c58fe1b436a5c774262bf84f3fd1b27eacbcf474552edc80b","id":"clock.utc.nq","version":"1"},"clock_uncertainty_ms":1,"ended_at":"2026-07-27T20:00:04Z","started_at":"2026-07-27T20:00:03Z"},"canonicalization":{"digest":"sha256:e49d92d4e86052e66ed2a481b9386d3b214ce3d2df5fd109a6491ccb9ffb24f3","id":"rfc8785-jcs","version":"1"},"claims":[{"claim_id":"claim:provider-testimony","condition_effect":"unresolved","dependency_input_ids":[],"limitations":["required provider testimony was not received"],"nonclaims":["the monitored subject is not established absent"],"proposition":"required provider testimony is available","required_distinctions":[],"state_binding_ids":[],"status":"unknown"}],"completed_at":"2026-07-27T20:00:04Z","evaluator":{"digest":"sha256:da5288d3196013574817382bb44c2d018c460f33c7eccf149bab3d21329cf72b","id":"evaluator:nq","version":"1"},"execution_clock":{"digest":"sha256:122a9d8aaab2d04c58fe1b436a5c774262bf84f3fd1b27eacbcf474552edc80b","id":"clock.utc.nq","version":"1"},"inputs":{"admitted":[],"excluded":[],"expected":[{"expectation_id":"expected:host-snapshot","required":true,"role":"host_snapshot"}],"failed":[{"expectation_id":"expected:host-snapshot","failure_id":"failure:no-response","kind":"no_response","reason":"the provider returned no response before its deadline"}],"received":[],"refused":[],"selected":[],"selection_rule":{"digest":"sha256:dab34757603c4ff00376ba6691cffba2b744ccaba136af3ae14240d5b365d2ff","id":"selection:newest-current","version":"1"}},"limitations":[],"nonclaims":["this artifact grants no reliance or authorization","this artifact reports one bounded diagnostic execution"],"outcome":{"coherence":"not_evaluated","condition":"unresolved","coverage":"missing","derivation":"partial","summary":"required provider testimony was not received"},"primary_claim_id":"claim:provider-testimony","producer":{"build":{"digest":"sha256:5f2c421dd8c15ea8fe7ed75ff223f449f622b76b413d63a34ff51e29bb4a2d10","id":"nq-build","version":"1"},"cohort":{"digest":"sha256:463db0ebf5839bbd5dd685dc21f7c00faa2da801cec4559431fa641a4cd33360","id":"nq-cohort","version":"1"},"node_id":"nq-node:fixture"},"profile":{"digest":"sha256:849583b5c74fdb0c1b2223a79fbd965038aa3981e30092d710ef52dca1f62677","id":"profile:host","version":"1"},"projection":{"identity":{"digest":"sha256:224b19ff377023d4d2b97cac8e3b06b14fc1f9efb8e0ba6220d527a8589ed16e","id":"projection:load-full","version":"1"},"omitted_distinctions":[]},"question":{"digest":"sha256:b2d6b993e3c0d4d02aa0ace0053ae55fd4b77a375f318dcb3c4fd43c67c57f0c","id":"diagnostic:host-load","version":"1"},"request_id":"request:001","run_id":"run:001","schema":"nq.diagnostic_execution.v1","started_at":"2026-07-27T20:00:03Z","state_bindings":[],"state_model":{"digest":"sha256:d4193d57ec67ad200a93f75d3014f66d533cdb91a7482150710256a3e0db8346","id":"state-model:boot","version":"1"},"subject":{"id":"host:fixture","scope":{"digest":"sha256:cfea2d9e350d18243cdd78a64f25a62376116ba7e4a717e8b13742c6ec277619","id":"scope:host","version":"1"}},"threshold_policy":{"digest":"sha256:1e582b43263de81f4bbdb0ea1ea4ef67f5c2779157b8c855142d56c1d88f1e12","id":"threshold:load","version":"1"},"vantage":{"digest":"sha256:7639f3c9683695aeb233f3561f06b32dba59e666819fcc47d5367692b071dd87","id":"vantage:host-local","version":"1"}}